acteurs,date,description,durée,genre,original_title,public,score,title
"Carl Sagan,Jaromír Hanzlík,Jonathan Fahn",1980,Astronomer Carl Sagan leads us on an engaging guided tour of the various elements and cosmological theories of the universe.,13,Documentary,,TV-PG,9.3,Cosmos
"James Gandolfini,Lorraine Bracco,Edie Falco",1999–2007,"New Jersey mob boss Tony Soprano deals with personal and professional issues in his home and business life that affect his mental state, leading him to seek professional psychiatric counseling.",55,Crime,,TV-MA,9.2,The Sopranos
,2014,An exploration of our discovery of the laws of nature and coordinates in space and time.,557,Documentary,,TV-PG,9.3,Cosmos: A Spacetime Odyssey
"Dee Bradley Baker,Zach Tyler Eisen,Mae Whitman",2005–2008,"In a war-torn world of elemental magic, a young boy reawakens to undertake a dangerous mystic quest to fulfill his destiny as the Avatar, and bring peace to the world.",23,Animation,,TV-Y7-FV,9.3,Avatar: The Last Airbender
,2017–2022,"David Attenborough returns to the world's oceans in this sequel to the acclaimed documentary filming rare and unusual creatures of the deep, as well as documenting the problems our oceans face.",364,Documentary,,TV-G,9.3,Blue Planet II
"Dominic West,Lance Reddick,Sonja Sohn",2002–2008,"The Baltimore drug scene, as seen through the eyes of drug dealers and law enforcement.",59,Crime,,TV-MA,9.3,The Wire
"Jessie Buckley,Jared Harris,Stellan Skarsgård",2019,"In April 1986, an explosion at the Chernobyl nuclear power plant in the Union of Soviet Socialist Republics becomes one of the world's worst man-made catastrophes.",330,Drama,,TV-MA,9.4,Chernobyl
,2001,"The story of Easy Company of the U.S. Army 101st Airborne Division and their mission in World War II Europe, from Operation Overlord to V-J Day.",594,Drama,,TV-MA,9.4,Band of Brothers
,2006,"Emmy Award-winning, 11 episodes, five years in the making, the most expensive nature documentary series ever commissioned by the BBC, and the first to be filmed in high definition.",538,Documentary,,TV-PG,9.4,Planet Earth
"Bryan Cranston,Aaron Paul,Anna Gunn",2008–2013,A chemistry teacher diagnosed with inoperable lung cancer turns to manufacturing and selling methamphetamine with a former student in order to secure his family's future.,49,Crime,,TV-MA,9.5,Breaking Bad
